{
  "symbol": "gCategory3SpawnTable",
  "family": "JETPACK",
  "length": 5608,
  "spawns": [
    {"kind": "STOPWATCH", "unk_03": 33, "x": -96, "y": -30, "z": 312},
    {"kind": "QUESTION_CRATE_WUMPA_3", "alt": "TIME_CRATE_1", "bonus": "HEALTH_CRATE", "unk_03": 138, "x": -4, "y": -30, "z": 398},
    {"kind": "QUESTION_CRATE_WUMPA_3", "alt": "TIME_CRATE_1", "bonus": "HEALTH_CRATE", "unk_03": 138, "x": -34, "y": -30, "z": 448},
    {"kind": "QUESTION_CRATE_WUMPA_3", "alt": "PARACHUTE_NITRO", "x": -68, "y": 15, "z": 510},
    {"kind": "QUESTION_CRATE_WUMPA_3", "alt": "TIME_CRATE_2", "unk_03": 138, "x": -4, "y": 30, "z": 578},
    {"kind": "QUESTION_CRATE_WUMPA_3", "alt": "TIME_CRATE_1", "unk_03": 138, "x": 32, "y": -30, "z": 636},
    {"kind": "PLANE", "unk_03": 138, "x": -16, "y": -30, "z": 727, "next": 8},
    {"kind": "PLANE", "unk_03": 138, "x": -20, "y": 30, "z": 728, "next": 9},
    {"kind": "PATH_5", "unk_03": 138, "x": 158, "y": -30, "z": 745},
    {"kind": "PATH_5", "unk_03": 138, "x": -146, "y": 90, "z": 750},
    {"kind": "AIRSHIP_0", "unk_03": 138, "x": 26, "y": 0, "z": 851},
    {"kind": "PLANE", "unk_03": 138, "x": 78, "y": 1, "z": 905, "next": 14},
    {"kind": "PLANE", "unk_03": 138, "x": -72, "y": 20, "z": 906, "next": 13},
    {"kind": "PATH_5", "unk_03": 138, "x": -88, "y": 60, "z": 963},
    {"kind": "PATH_5", "unk_03": 138, "x": 134, "y": -59, "z": 966},
    {"kind": "PLANE", "x": -96, "y": 30, "z": 1360, "next": 17},
    {"kind": "PLANE", "x": 96, "y": -30, "z": 1360, "next": 18},
    {"kind": "PATH_4", "x": 32, "y": -30, "z": 1420},
    {"kind": "PATH_4", "x": -32, "y": 30, "z": 1424},
    {"kind": "QUESTION_CRATE_WUMPA_3", "alt": "PARACHUTE_NITRO", "x": -18, "y": -40, "z": 1456},
    {"kind": "QUESTION_CRATE_WUMPA_5", "alt": "TIME_CRATE_3", "x": 44, "y": -30, "z": 1496},
    {"kind": "QUESTION_CRATE_WUMPA_5", "alt": "TIME_CRATE_3", "unk_03": 138, "x": 32, "y": 30, "z": 1537},
    {"kind": "QUESTION_CRATE_WUMPA_3", "alt": "PARACHUTE_NITRO", "x": 4, "y": 0, "z": 1576},
    {"kind": "QUESTION_CRATE_WUMPA_5", "alt": "HEALTH_CRATE", "x": -20, "y": -30, "z": 1605},
    {"kind": "QUESTION_CRATE_LIFE", "alt": "TIME_CRATE_1", "x": -6, "y": 30, "z": 1662},
    {"kind": "HEALTH_CRATE", "unk_03": 138, "x": -24, "y": 30, "z": 1700},
    {"kind": "QUESTION_CRATE_WUMPA_3", "alt": "TIME_CRATE_1", "x": -16, "y": 0, "z": 1787},
    {"kind": "QUESTION_CRATE_WUMPA_3", "alt": "TIME_CRATE_2", "bonus": "HEALTH_CRATE", "unk_03": 138, "x": -34, "y": -30, "z": 1824},
    {"kind": "QUESTION_CRATE_WUMPA_3", "alt": "PARACHUTE_NITRO", "x": -46, "y": 40, "z": 1856},
    {"kind": "QUESTION_CRATE_WUMPA_3", "alt": "TIME_CRATE_1", "x": -72, "y": -30, "z": 1890},
    {"kind": "PARACHUTE_NITRO", "unk_03": 138, "x": 4, "y": -10, "z": 1917},
    {"kind": "QUESTION_CRATE_LIFE", "alt": "PARACHUTE_NITRO", "x": 48, "y": 30, "z": 1949},
    {"kind": "PLANE", "unk_03": 138, "x": 96, "y": 30, "z": 1968, "next": 36},
    {"kind": "PLANE", "unk_03": 138, "x": -96, "y": 30, "z": 1968, "next": 35},
    {"kind": "PLANE", "unk_03": 138, "x": 2, "y": 0, "z": 1969, "next": 39},
    {"kind": "PATH_3", "unk_03": 138, "x": -14, "y": 1, "z": 1982, "next": 37},
    {"kind": "PATH_3", "unk_03": 138, "x": 4, "y": 1, "z": 1983, "next": 38},
    {"kind": "PATH_4", "unk_03": 138, "x": -160, "y": 90, "z": 2032},
    {"kind": "PATH_4", "unk_03": 138, "x": 160, "y": 90, "z": 2032},
    {"kind": "PATH_4", "unk_03": 138, "x": -2, "y": -90, "z": 2033},
    {"kind": "QUESTION_CRATE_WUMPA_1", "alt": "TIME_CRATE_1", "x": -22, "y": 30, "z": 2035},
    {"kind": "AIRSHIP_0", "unk_03": 138, "x": 42, "y": -30, "z": 2160},
    {"kind": "BOMBER_HOME", "x": 72, "y": 30, "z": 2258},
    {"kind": "BOMBER_HOME", "x": -28, "y": 30, "z": 2272},
    {"kind": "PLANE", "x": -96, "y": 30, "z": 2780, "next": 47},
    {"kind": "PLANE", "x": 94, "y": -30, "z": 2780, "next": 46},
    {"kind": "PATH_5", "x": -52, "y": -30, "z": 2844},
    {"kind": "PATH_5", "x": 48, "y": 30, "z": 2844},
    {"kind": "QUESTION_CRATE_LIFE", "alt": "TIME_CRATE_1", "x": 20, "y": 30, "z": 2851},
    {"kind": "HEALTH_CRATE", "unk_03": 155, "x": 8, "y": 0, "z": 2859},
    {"kind": "PARACHUTE_NITRO", "unk_03": 155, "x": -38, "y": -10, "z": 2883},
    {"kind": "QUESTION_CRATE_WUMPA_5", "alt": "TIME_CRATE_3", "x": 32, "y": -30, "z": 2925},
    {"kind": "PARACHUTE_NITRO", "x": 26, "y": -30, "z": 2959},
    {"kind": "QUESTION_CRATE_WUMPA_1", "alt": "TIME_CRATE_1", "unk_03": 138, "x": -44, "y": -30, "z": 2984},
    {"kind": "QUESTION_CRATE_WUMPA_5", "alt": "TIME_CRATE_3", "x": -48, "y": -30, "z": 3029},
    {"kind": "PARACHUTE_NITRO", "unk_03": 155, "x": 8, "y": -29, "z": 3072},
    {"kind": "PARACHUTE_NITRO", "unk_03": 155, "x": 14, "y": -47, "z": 3103},
    {"kind": "QUESTION_CRATE_WUMPA_3", "alt": "HEALTH_CRATE", "x": 14, "y": 31, "z": 3159},
    {"kind": "QUESTION_CRATE_WUMPA_5", "alt": "TIME_CRATE_3", "unk_03": 138, "x": 6, "y": -30, "z": 3194},
    {"kind": "QUESTION_CRATE_WUMPA_5", "alt": "TIME_CRATE_1", "x": -96, "y": -30, "z": 3232},
    {"kind": "PLANE", "x": 8, "y": 30, "z": 3288, "next": 61},
    {"kind": "PATH_3", "unk_03": 108, "x": 6, "y": 0, "z": 3303, "next": 62},
    {"kind": "PATH_4", "unk_03": 108, "x": 4, "y": -90, "z": 3328, "next": 63},
    {"kind": "PATH_4", "unk_03": 108, "x": 0, "y": -119, "z": 3356},
    {"kind": "PLANE", "x": 2, "y": 30, "z": 3367, "next": 65},
    {"kind": "PATH_3", "x": 6, "y": -7, "z": 3382, "next": 66},
    {"kind": "PATH_4", "x": -120, "y": -21, "z": 3408, "next": 67},
    {"kind": "PATH_4", "x": -148, "y": 0, "z": 3436},
    {"kind": "PLANE", "x": 0, "y": 30, "z": 3447, "next": 69},
    {"kind": "PATH_3", "x": 0, "y": -7, "z": 3462, "next": 70},
    {"kind": "PATH_4", "x": 68, "y": 59, "z": 3488, "next": 71},
    {"kind": "PATH_4", "x": 96, "y": 91, "z": 3519},
    {"kind": "QUESTION_CRATE_WUMPA_1", "alt": "TIME_CRATE_1", "x": 32, "y": -30, "z": 3684},
    {"kind": "QUESTION_CRATE_WUMPA_1", "alt": "TIME_CRATE_1", "x": 32, "y": -30, "z": 3716},
    {"kind": "PARACHUTE_NITRO", "x": 32, "y": -30, "z": 3760},
    {"kind": "BOMBER_HOME", "x": 0, "y": 30, "z": 3813},
    {"kind": "BOMBER_IDLE", "unk_03": 108, "x": 6, "y": -90, "z": 3848},
    {"kind": "BOMBER_IDLE", "unk_03": 108, "x": 2, "y": 90, "z": 3848},
    {"kind": "QUESTION_CRATE_WUMPA_1", "alt": "TIME_CRATE_1", "x": -96, "y": -30, "z": 3852},
    {"kind": "BOMBER_DROP", "x": -2, "y": -30, "z": 3874},
    {"kind": "HEALTH_CRATE", "x": -96, "y": -30, "z": 3888},
    {"kind": "BOMBER_IDLE", "unk_03": 108, "x": 30, "y": -61, "z": 3896},
    {"kind": "BOMBER_IDLE", "unk_03": 108, "x": -30, "y": 61, "z": 3896},
    {"kind": "BOMBER_IDLE", "unk_03": 108, "x": 30, "y": 61, "z": 3896},
    {"kind": "BOMBER_IDLE", "unk_03": 108, "x": -28, "y": -61, "z": 3896},
    {"kind": "BOMBER_IDLE", "unk_03": 108, "x": 72, "y": 30, "z": 3944},
    {"kind": "BOMBER_IDLE", "unk_03": 108, "x": -68, "y": -30, "z": 3944},
    {"kind": "BOMBER_IDLE", "unk_03": 108, "x": -62, "y": 30, "z": 3944},
    {"kind": "BOMBER_IDLE", "unk_03": 108, "x": 60, "y": -30, "z": 3944},
    {"kind": "BOMBER_IDLE", "unk_03": 108, "x": 6, "y": 30, "z": 3944},
    {"kind": "BOMBER_IDLE", "unk_03": 108, "x": -2, "y": -30, "z": 3944},
    {"kind": "BOMBER_CIRCLE", "unk_03": 138, "x": 96, "y": -30, "z": 3984},
    {"kind": "BOMBER_CIRCLE", "unk_03": 138, "x": -96, "y": -30, "z": 3984},
    {"kind": "BOMBER_IDLE", "unk_03": 138, "x": 32, "y": -30, "z": 3984},
    {"kind": "BOMBER_IDLE", "unk_03": 138, "x": -32, "y": -30, "z": 3984},
    {"kind": "PLANE", "x": 96, "y": -90, "z": 4068, "next": 96},
    {"kind": "PATH_3", "x": 96, "y": 30, "z": 4084, "next": 98},
    {"kind": "PLANE", "x": -96, "y": 91, "z": 4128, "next": 99},
    {"kind": "PATH_4", "x": 160, "y": -90, "z": 4136},
    {"kind": "PATH_3", "x": -100, "y": -30, "z": 4144, "next": 101},
    {"kind": "RING_LEFT", "x": 80, "y": -90, "z": 4181},
    {"kind": "PATH_4", "x": -156, "y": 95, "z": 4196},
    {"kind": "RING_LEFT", "x": 0, "y": 30, "z": 4320},
    {"kind": "RING_LEFT", "x": -80, "y": 90, "z": 4477},
    {"kind": "RING_LEFT", "x": -12, "y": 30, "z": 4614},
    {"kind": "RING_LEFT", "x": 86, "y": -90, "z": 4746},
    {"kind": "RING_LEFT", "x": -2, "y": 30, "z": 4867},
    {"kind": "QUESTION_CRATE_WUMPA_1", "alt": "PARACHUTE_NITRO", "x": -32, "y": 30, "z": 4956},
    {"kind": "PLANE", "x": -110, "y": 30, "z": 5011, "next": 111},
    {"kind": "PLANE", "x": 126, "y": -30, "z": 5012, "next": 110},
    {"kind": "PATH_1", "x": 114, "y": -10, "z": 5040, "next": 112},
    {"kind": "PATH_1", "x": -30, "y": 10, "z": 5041, "next": 113},
    {"kind": "PATH_2", "x": 38, "y": -5, "z": 5061, "next": 114},
    {"kind": "PATH_2", "x": 6, "y": 5, "z": 5070, "next": 115},
    {"kind": "PATH_3", "x": -24, "y": 0, "z": 5084, "next": 116},
    {"kind": "PATH_3", "x": 104, "y": 0, "z": 5087, "next": 117},
    {"kind": "PATH_4", "x": -110, "y": 11, "z": 5102},
    {"kind": "PATH_4", "x": 70, "y": -12, "z": 5103},
    {"kind": "AIRSHIP_1", "x": 52, "y": -5, "z": 5190},
    {"kind": "BOMBER_DROP", "x": -32, "y": 30, "z": 5204},
    {"kind": "BOMBER_DROP", "x": 32, "y": -30, "z": 5236}
  ],
  "end": [64, 5, 0, 0]
}
